DOI,PPC_Year,Abstract,agree,clarification,question,recommendation,disagree
10.1073/pnas.1414857111,2015,A vibrant discussion of the merits and limitations of animal models is long overdue. The limitation of space precludes addressing many of the questionable approaches and statements by Takao and Miyakawa (1).,0.06443499773740768,0.14647062122821808,0.45870688557624817,0.12463332712650299,0.2057541310787201
10.1073/pnas.1015229108,2011,"Haskew-Layton et al. (1) reported that subtoxic doses of H2O2 fails to activate nuclear factor erythroid 2-related factor (Nrf2) in astrocytes and triggers Nrf2-independent responses that protect cocultured neurons. Contrary to this, we show that mild oxidative insults, including subtoxic H2O2, strongly activate astrocytic Nrf2/antioxidant response element (ARE)-dependent gene expression, which, moreover, contributes to neuroprotective ischemic preconditioning.",0.007828062400221825,0.13760261237621307,0.054527007043361664,0.008159449324011803,0.7918828725814819
10.1073/pnas.1600282113,2016,"Lieberman and Eisenberger (1) claim that the dorsal anterior cingulate cortex (dACC) is selective for pain. This surprising conclusion contradicts a large body of evidence showing robust dACC responses to nonpainful conditions. Electrophysiological and optogenetic studies have identified neuronal populations activated during foraging behavior, attention, emotion, reward expectancy, skeletomotor and visceromotor activity, and other functions (e.g., refs. 25). Only a small minority of dACC neurons are pain-related.",0.01667727530002594,0.04307365417480469,0.18540608882904053,0.028506683185696602,0.7263363003730774
10.1073/pnas.1606615113,2016,"To understand the impact of microplastic (MP) pollution to aquatic ecosystems, it is important to identify the mechanisms of interaction with organisms. Exposure experiments, like the study of Sussarellu et al. (1) recently published in PNAS, may provide such insights. However, the results of doseresponse experiments must always be interpreted in light of environmental concentrations, and the experimental concentrations examined by Sussarellu et al. (1) and several others (28) are orders-of-magnitude higher than those reported from field studies (Fig. 1).",0.1863984763622284,0.17276282608509064,0.2646969258785248,0.045063506811857224,0.3310781717300415
10.1073/pnas.2200300119,2022,"Thaler and Sunsteins nudge (1) has spawned a revolution in behavioral science research. Despite its popularity, the nudge approach has been criticized for having a limited evidence base (e.g., ref. 2). Mertens et al. (3) seek to address that limitation with a timely and comprehensive metaanalysis. Mertens et al.s headline finding is that choice architecture [nudging] is an effective and widely applicable behavior change tool (p. 8). We propose their finding of moderate publication bias (p. 1) is the real headline; when this publication bias is appropriately corrected for, no evidence for the effectiveness of nudges remains (Fig. 1).",0.12635652720928192,0.3671262562274933,0.13730624318122864,0.21868060529232025,0.1505303978919983
10.1073/pnas.1307927110,2013,"Hannah et al. (1) recently published a comprehensive study showing substantial impacts of climate change on viticultural suitability, leading to potential ecological issues. We agree that expansion of viticulture into new areas can lead to a decrease in biodiversity and that an increase in water use for irrigation might lead to major freshwater conservation impacts. However, we disagree with the alarming statement that suitability for winegrowing of main wine-producing areas worldwide will dramatically decrease over the next 40 y. We point out major methodological flaws in ref. 1, mostly linked to (i) the misuse of bibliographical data to compute suitability index, (ii) underestimation of adaptations of viticulture to warmer conditions, and (iii) the inadequacy of the monthly time step in the suitability approach.",0.10559289157390594,0.09707111120223999,0.07240626215934753,0.027754995971918106,0.6971747279167175
10.1073/pnas.1614961114,2017,"We strongly disagree with Eklund et al.s (1) summary statement: Alarmingly, the parametric methods can give a very high degree of false positives (up to 
, compared with the nominal 
). For comparison, their own nonparametric methods results actually showed up to 40% FPR. When characterizing results, medians or percentile ranges are generally more informative summary statistics than maxima. Looking backward, the typical ranges show much smaller FPR inflation than what had been highlighted, and looking forward they provide useful suggestions for experimental design and analyses (lower voxelwise 
, event-related paradigms, etc.). By concentrating on the highest observed FPRs, the conclusions of Eklund et al. (1) are unnecessarily alarmist.",0.012878848239779472,0.11068767309188843,0.05066461116075516,0.12776578962802887,0.6980029940605164
10.1073/pnas.1207143109,2012,"In PNAS, the work by Schoch et al. (1) proposed nuclear ribosomal DNA internal transcribed spacer (ITS) sequences as the sole universal barcode for fungi. The work by Schoch et al. (1) stated that the proposal will satisfy most fungal biologists but not all (1).
I am among those biologists who are not so satisfied and not really surprised either, because ITS has been the most widely used marker for species identifications in mycology since the development of the first universal primers to amplify this DNA region in fungi. Its use as an unofficial fungal species barcode has also been criticized (2). It was also criticized because of its limits, including intraspecific variation. This aspect was discussed in the work by Schoch et al. (1) from different perspectives except one: the methodological dimension of revealing intraspecific variation in the ITS region.",0.030427124351263046,0.158693328499794,0.12466654926538467,0.06291203945875168,0.6233009099960327
10.1073/pnas.1304625110,2013,"As shown in Fig. 1B [also in figures S1 and S3 of Zhang et al. (1)], there is indeed an increase in the nongrowing season Système Pour l'Observation de la Terre (SPOT) NDVI for the steppes and meadows in the TP. After eliminating the impact of nongrowing season NDVI increase, we found no change of green-up dates in 20092011 compared with that in 19982000 (Fig. 1B). A similar result was also found using the Moderate Resolution Imaging Spectroradiometer (MODIS) NDVI data (Fig. 1C). Furthermore, because the green-up onset in the TP usually occurs in May and June during the period from 1998 to 2011 (1, 3, 4), the advance in green-up dates should result in an increase in the difference of NDVI between May and April, according to the method for retrieving green-up dates (2). However, such increase was not found in the NDVI datasets from both SPOT and MODIS (Fig. 1D). Therefore, so far, there is no evidence for the continuously advancing trend of green-up dates in the TP over the last decade. The continuously advancing trend of green-up dates revealed by Zhang et al. (1) is likely caused by not correcting for the increased nongrowing season NDVI.",0.05963979661464691,0.283795565366745,0.24335530400276184,0.045564018189907074,0.3676453232765198
10.1073/pnas.1502596112,2015,"Building upon fine particulate matter (PM2.5) data and the accompanying meteorological conditions in the fall of 2013, Guo et al. (1) conclude that local aerosol nucleation and growth dominantly contributed to severe haze in Beijing, whereas regional transport of PM2.5 played an insignificant role. Guo et al.s conclusion is surprising because it not only requires an uncharacteristic aerosol formation mode for Beijing, but also goes against a broadly held view that the entire eastern China region, or at least the North China Plain should be looked at as a single air basin if Beijings air quality is to be improved (2). Instead of curtailing the emission of aerosol precursor gases in a broader region, Guo et al.s (1) conclusion would advocate a campaign on limiting traffic and emission within and around the immediate vicinity of Beijing. Already, Beijings municipal government has increased urban traffic controls as its number one tactic in an effort to reduce PM2.5.* However, we believe that an in-depth scrutiny of the data makes science more accurate and science-based actions more efficient.",0.02994629554450512,0.16696403920650482,0.2215062528848648,0.16182710230350494,0.4197562634944916
10.1073/pnas.1314188110,2013,"According to a recent article in PNAS by Gebbie et al., ionic liquids (ILs) should be considered as dilute electrolyte solutions, consisting of ion pairs of which only a small fraction are dissociated (1). This claim is based upon measurements of weak attractive forces between a mica surface and a gold surface across ILs, attributed to double-layer attraction. From the decay length of the attractive force (1013 nm), an effective free-ion concentration is deduced by fitting to a modified DerjaguinLandauVerweyOverbeek (DLVO) theoretical expression. However, the overwhelming evidence from the thermodynamic and transport properties of similar ILs is that they are not composed of neutral ion pairs with simple dissociation equilibria, and, as such, the DLVO framework is inappropriate. Rather, the liquid should be considered as strongly dissociated with ions interacting to varying extents with several nearby counterions (2, 3). The authors support their assertion of weak dissociation by calculating the binding energy of an ion pair, relative to isolated ions in a dielectric medium. However, they do not contrast this with the energetics of a dense, locally charge-ordered ionic melt that is the likely state of the fluid. In the same limited framework, NaCl would be expected to be an ion-pair fluid.",0.03181884437799454,0.21504762768745422,0.2065606266260147,0.1563856154680252,0.39018726348876953
10.1073/pnas.1306157110,2013,"To quantify the change in snow cover on the Tibet Plateau, we used snow cover fraction (SCF, %) from 0.05 degree MODIS/Terra 8-Day Snow Cover dataset from 2000 to 2011. Our analyses showed that SCF during JanuaryApril decreased from 2000 to 2011 over a majority of pixels (Fig. 1A), which caused the corresponding NDVI to rise (Fig. 1 B and C). This rise in NDVI can be expected because the presence of snow can diminish NDVI (5). More importantly, we found that the extracted SOS from Zhang et al. (1) was not only negatively correlated with NDVI in May (MODIS, R2 = 0.36, P < 0.05; SPOT-VGT, R2 = 0.61, P < 0.01) when the onset of growing season on the Tibetan Plateau mainly occurred (1, 2), but also negatively related to JanuaryApril NDVI (MODIS, R2 = 0.47, P < 0.05; SPOT-VGT, R2 = 0.61, P < 0.01) (Fig. 1D) during the period 20002011. These significant correlations suggested that advances in spring phenology observed by Zhang et al. (1) may be influenced by increasing JanuaryApril NDVI values due to the declining snow cover. Thus, snow cover change in nongrowing season should not be dismissed in detection of long-term trends in spring phenology.",0.24889011681079865,0.33656439185142517,0.17613261938095093,0.1080922931432724,0.13032057881355286
10.1073/pnas.1619514114,2017,"Nitrogen (N) is the building block of life. Quantifying the sources and sinks of N to the ocean is essential for predicting its productivity and potential carbon sequestration. In his paper, Gruber (1) seeks for elusive marine nitrogen fixation following results from Knapp et al. (2), who measured unexpectedly low N input through N2 fixation in the eastern tropical South Pacific (ETSP), seriously bringing into question the proposed close spatial coupling between N input (through N2 fixation) and loss (through denitrification) (3). Here, we compile data from recently published and unpublished studies revealing a hot spot of N2 fixation in the western tropical South Pacific (WTSP) arguing for a spatial decoupling between N sources and sinks in the South Pacific.",0.019989393651485443,0.21142607927322388,0.5379663705825806,0.0901971235871315,0.140421062707901
10.1073/pnas.1610005113,2016,"In a narrow critique of two early papers in the literature on cumulative cultural evolution, Vaesen et al. (1) misunderstand the work they criticize, mischaracterize multiple lines of research, and selectively ignore much evidence. While largely recycling prior criticisms, they provide no new models, evidence, or explanations (2).",0.027854861691594124,0.056253548711538315,0.2981765568256378,0.02144807204604149,0.5962669253349304
10.1073/pnas.0807266106,2008,"Whole-lake experiments by Schindler and others since 1971 have conclusively shown that phosphorus is the major cause of eutrophication in freshwater lakes (1). In response, in the 1970s governments began to reduce phosphorus inputs, and water quality in many lakes improved dramatically. However, eutrophication has increased in many coastal marine ecosystems since the 1970s, including the Chesapeake Bay, Long Island Sound, and the Gulf of Mexico Dead Zone. Why? Nitrogen contributes to eutrophication in these ecosystems, and nitrogen pollution has grown tremendously since the 1970s (2, 3).
Unfortunately, Schindler et al. (1) generalize their lake results to estuarine and coastal ecosystems, suggesting that the controls on eutrophication in lakes and coastal waters are the same. If this is true, reducing nitrogen in coastal systems could cause blooms of nitrogen-fixing cyanobacteria, as occurs in many lakes. Substantial research over 2 decades demonstrates that this premise is wrong, and in most estuaries and coastal waters worldwide with salinities exceeding 68, planktonic, nitrogen-fixing cyanobacteria do not occur because their growth is controlled by factors other than phosphorus supply (24). At least 1 of these other controls (grazing) apparently is relaxed in offshore waters such as the Mid-Pacific Gyre in which Trichodesmium fixes significant quantities of nitrogen. But the nitrogen fixers are missing from most estuaries and coastal seas.",0.0523071363568306,0.13179247081279755,0.2540057301521301,0.05661037564277649,0.505284309387207
10.1073/pnas.1018390108,2011,"Yu et al. (1) reported that the beginning of vegetation growing season (BGS) of the alpine steppe and meadow on the Tibetan Plateau was delayed since the mid-1990s under warming winter and spring (1). They wrote that this delay appeared to be related to later fulfillment of chilling requirements, and they suggested that continued warming may strengthen this effect or even reverse the advancing trend in spring phenology (1).
This idea was proposed earlier for phenology of some species (2) and was tested on the alpine vegetations at the regional level. Using this idea, if winter warming continues and spring warming does not accelerate, the delaying trend should continue. We found, however, that, despite the continued winter warming and the fluctuating spring temperature (Tspring is the mean temperature of April, May, and June) during the period from 1998 to 2009, BGS calculated from Systeme Probatoire d'Observation dela Tarre Normalized Difference Vegetation Index (NDVI) showed no continued delaying trend (Fig. 1).",0.06563166528940201,0.2608218491077423,0.22686216235160828,0.23728209733963013,0.20940221846103668
10.1073/pnas.1018876108,2011,"Squire et al. (1) recently asserted that patients with bilateral hippocampal damage can imagine future experiences. This contradicts a number of previous reports where amnesia and bilateral hippocampal lesions have been found to cause significant impairment in imagining fictitious and future scenarios (24). Based on their findings, Squire et al. (1) concluded that the capacity for imagining the future is independent of the hippocampus. However, there are several aspects of their study that make this conclusion uncertain.",0.024655068293213844,0.07331354916095734,0.12134581059217453,0.0253393966704607,0.7553462386131287
10.1073/pnas.0908069106,2009,"As the carbon footprint elaboration has shown, a clear concept and definitions of terms are required for proper communication (3). While in carbon footprinting weighting between various greenhouse gases according to global warming potentials is needed, we think that a distinction between the various origins of water use is useful, because the resulting environmental impacts vary largely from region to region. For instance, 1 L of water consumed in the Colorado watershed does not compare to 1 L of water from the Mississippi, because water is much more scarce in the Colorado watershed. Therefore, an extension of the work performed by Gerbens-Leenes and colleagues seems necessary to us, to capture environmental relevance. To clarify our view, a water footprint scheme consistent to that of carbon footprinting in terms of the relevant features is presented in Table 1. It deviates, in part, from the water footprint as presented by Gerbens-Leenes et al. and shows that a further discussion of the concept is necessary.",0.023410391062498093,0.7526866793632507,0.0787913128733635,0.037992484867572784,0.1071191355586052
10.1073/pnas.1100091108,2011,"In their recent paper Winter and spring warming result in delayed spring phenology on the Tibetan Plateau, Yu et al. (1) reported an interesting but unexpected result that spring phenology initiated retreating in the mid-1990s, despite continued warming for grasslands (both steppe and meadow) on the Tibetan Plateau, and shortening the length of the growing season of the steppe together with an advancing end. Although we have not observed the same phenomenon in our own many years of field studies on the eastern edge of the Tibetan Plateau, we believed that there were indeed some complicated yet poorly understood dynamics and processes in the phenology on the Tibetan Plateau. However, we believe their causes should include factors such as grassland degradation, thawingfreezing processes, climate warming, and their combined effect rather than a sole factor of climate change, like winter and spring warming.",0.05374960973858833,0.22492806613445282,0.3075082004070282,0.09680121392011642,0.3170129060745239
10.1073/pnas.0813294106,2009,"Beale et al. (1) reported that speciesclimate associations estimated with envelope models were no better than expected by chance for 68% of the European birds studied. Beale et al. estimated speciesclimate associations with 4 variables, including soil water availability and ignored ?11% of the available bird species records for Europe, i.e., all probable and confirmed records with <10 breeding pairs and all possible breeding records.
We agree with Beale et al. (1) that there are algorithmic as well as ecological uncertainties with envelope models (46). However, we found no evidence that speciesclimate associations among European birds and climate are no stronger than expected by chance. Their conclusions are, therefore, overstated.",0.6351033449172974,0.08323772251605988,0.14845697581768036,0.035663340240716934,0.0975385382771492
10.1073/pnas.0912158107,2010,"According to a recent article (1), the structure of water should be regarded as inhomogeneous on the 1-nm-length scale. This claim is made on the basis of small-angle x-ray scattering data and x-ray absorption/emission data. For a single component fluid, the Q = 0 value of the structure factor, S(Q), is given by

where N is the number of molecules in any given volume of the fluid and the angle brackets indicate ensemble averages. Diverging density fluctuations near a critical point cause S(Q) to rise substantially at low Q. Does the small low-Q rise in S(Q) observed in noncritical ambient water justify the claim made in (1) that water is heterogeneous on some length scale? We think not.",0.05172547325491905,0.10501531511545181,0.31202343106269836,0.06396040320396423,0.4672754108905792
10.1073/pnas.1218748110,2013,"Hansen et al. (1) demonstrated that the probability of extremely hot summers has markedly increased because the mean of the distribution of seasonally averaged temperatures has increased. However, the authors also implied that the variance of the distribution has increased, a result that differs from regional studies that show changes in the extremes are consistent with a simple shift in the mean (2, 3). Here we extend the spatially aggregated distribution analysis of Hansen et al. to show that once issues related to normalizations, trends, and reductions in surface-station density are accounted for, there is no indication that variability about the mean has increased, at least using these methods and data.",0.05897131934762001,0.23619140684604645,0.23499196767807007,0.03772972151637077,0.4321155250072479
10.1073/pnas.0900016106,2009,"Anthony et al. (4) recently demonstrate that SIGN-R1, a C-type lectin receptor on mouse splenic macrophages, recognizes and mediates anti-inflammatory effects of sialylated IgG Fc. In addition, the authors report that sialylated IgG Fc proteins also bind to DC-SIGN, the human orthologue of SIGN-R1. However, it is important to note that DC-SIGN and SIGNR1 differ significantly in their cellular and tissue distribution. Because DC-SIGN is expressed specifically on human dendritic cells (DC), we sought to explore whether DC-SIGN and ?2,6-sialylated IgG Fc interaction is indispensable for the anti-inflammatory effect of IVIg in the context of human DC.
Interestingly, we found that both intact IVIg and F(ab?)2 fragments of IVIg that lacks the Fc region, and hence lacking terminal ?2,6-sialic acid linkages, inhibit TLR-mediated activation of DC as assessed by phosphorylation of ERK1/2 (Fig. 1), an intracellular signaling molecule that mediates inflammatory response of DC upon interaction with TLR agonists. The results suggest that DC-SIGN and ?2,6-sialylated IgG Fc interaction is dispensable for the anti-inflammatory activity of IVIg on human DC. In fact, we found that IVIg also targets CD40 on human DC (5). Therefore, caution should be exercised while translating results from murine models to patients.",0.05639592558145523,0.3435108959674835,0.2620372176170349,0.06453313678503036,0.27352288365364075
10.1073/pnas.1310657110,2013,"In a recent article in PNAS, Sondermann et al. propose a mechanism to explain the putative sialic acid-dependent binding of IgG Fc to DC-SIGN, as well as to the IgE receptor, CD23 (2). The core of their hypothesis is that sialylation of IgG Fc leads to a conformational change, which triggers DC-SIGN binding. To directly assess this hypothesis, we have generated ?2,6-sialylated IgG1 Fc (sFc) that we both chemically verified by HPLC analysis (Fig. 1A) and structurally characterized by X-ray crystallographic analysis to a resolution of 2.3 Å (Fig. 1 B and C, and Table 1).
Our crystallographic analysis also shows that Fc sialylation does not perturb the classic proteincarbohydrate interactions observed of asialylated IgG Fc (Fig. 1C). We note that these observations are consistent with solution-state NMR measurements (3). We observe extensive electron density corresponding to 20 monosaccharide residues (Fig. 1C). There are two sialic acid attachment sites per biantennary N-linked glycan on the 3-arm and 6-arm (Fig. 1C). There is observable electron density for sialic acid on the 6-arm and, in contrast with the proposed model by Sondermann et al. (2), this glycan moiety projects in a solvent-exposed manner away from the protein surface. Similarly, the 3-arm is not, as proposed, tightly immobilized to the protein surface but is instead entirely solvent exposed.
We note that the experimental support for the proposed conformational changes includes circular dichroism, which gives exquisitely sensitive readouts to changes in local but not tertiary or quaternary structure. In addition, the melting temperature shift observed by Sondermann et al. (2) is well within the range of other Fc glycoforms, whereas deglycosylation leads to a more significant change in stability (4).",0.18212120234966278,0.35199424624443054,0.10201025009155273,0.048254091292619705,0.3156202435493469
10.1073/pnas.1010507107,2010,"Assigning credibility or expertise is a fraught issue, particularly in a wicked phenomenon like climate changeas Anderegg et al. (1) discussed in a recent issue of PNAS. However, their analysis of expert credibility into two distinct convinced and unconvinced camps and the lack of nuance in defining the terms climate deniers, skeptics, and contrarians both oversimplify and increase polarization within the climate debate.",0.04002455249428749,0.06589379161596298,0.39451685547828674,0.06237991154193878,0.43718498945236206
10.1073/pnas.1509189112,2015,"In their recent article, Jenkins et al. (1) identify priorities for future conservation investment in the continental United States. To find these priority areas, the authors weighted species from six taxa by their range size and level of protection, summing the weighted maps to derive maps of priority scores. Such scoring systems defy contemporary planning approaches, and have repeatedly been shown to identify priorities that are biologically ineffective and economically inefficient (2).",0.10987196862697601,0.14292287826538086,0.18370549380779266,0.12493379414081573,0.43856582045555115
