DOI,PPC_Year,Abstract,agree,clarification,question,recommendation,disagree
10.1038/274513c0,1978,"THE report of Leysen et al.¹ concerning the binding of the relatively new radiolabel 3H-spiperone to dopamine (DA) and both 5-hydroxy- tryptamine (5-HT) receptor sites suggests that caution is needed in using this radioligand for DA receptor binding frontal cortex suggest that the drug bind- ing observed in frontal cortex may largely represent an interaction with 5-HT receptors, whereas in basal ganglia tissue H-spiperone binding occurs pre- dominantly to DA receptors.

Spiperone, and certain other neuroleptic drugs, apparently interact with high affinity at both DA and 5-HT receptors in the CNS; our estimates of Ka values for H-spiperone binding in rat striatum (K=0.25 nM) and medial frontal cortex (Ka = 0.5 nM) indicate only a small difference in the affinity of spiperone binding at these different sites (DA and 5-HT); in human tissue the Ka for these two areas is, in fact, the same (Ka=0.5 nM). Similarly, as reported previously, the neuroleptic drug butaclamol interacts potently and stereoselectively at both these sites. Figure 1b shows that specific binding of H-spiperone, defined as that displaced by 1 µM (+)-butaclamol, is detectable in homogenates of both striatum and medial frontal cortex although (+)-butaclamol is slightly less potent in inhibiting H- spiperone binding in the cortical pre- parations. Thus, the use of the isomers of butaclamol to define 'specific' binding of H-spiperone exclusively to CNS DA receptors would clearly yield misleading results.

The highly selective displacement of H-spiperone from its binding sites in striatum by the DA agonist ADTN, makes this drug the most suitable for defining DA receptor binding in rat and human brain.",0.03389434516429901,0.25106993317604065,0.2009759247303009,0.013307129964232445,0.5007526874542236
10.1038/259157c0,1976,"RECENTLY evidence' showed that micro- organisms can transform certain lead compounds into Me Pb; addition of Me, PbOAc to sediment samples ap- parently always increased the production of Me Pb. The addition, of lead(II) com- pounds did not, however, lead to definite effects, and with pure bacterial isolates no transformation of Pb2+ to Me Pb could be observed¹. Doubt has since been cast on the significance of a microbiological conversion of Me PbOAc to Me Pb, 3 chemical preferring a mechanism; also alkylation of Pb(NO3) could not be detected (ref. 2).

Our studies of the behaviour of lead compounds in the presence of micro- organisms show that Pb2+ can be biolog- ically alkylated to Me,Pb, and this helps to explain the formation of Me Pb from Me, PbOAc in anaerobic systems.",0.17229822278022766,0.38529083132743835,0.16471104323863983,0.0930321142077446,0.18466778099536896
10.1038/s41586-019-1582-8,2019," Recently, DeVries et al.1 attempted to solve this scientific problem by deep learning. Using the area under the curve (AUC) of receiver operating characteristic curves, the authors showed that a deep neural network (DNN) considerably outperformed classical Coulomb stress. Here we first clarify that similar performances had already been obtained (by the same authors, in 2017)2 for various scalar stress metrics, suggesting that deep learning does not actually improve prediction. Second, we reformulate the 2017 results2 using two-parameter logistic regression (that is, one neuron) and obtain the same performance as that of the 13,451-parameter DNN. We further show that a logistic regression based on the measured distance and mainshock average slip (instead of derived stresses) performs better than the DNN. This demonstrates that so far the proposed deep learning strategy does not provide any new insight (predictive or inferential) in this domain.",0.047142595052719116,0.818860650062561,0.0446857213973999,0.009218104183673859,0.08009285479784012
10.1038/s41586-020-2216-x,2020,"Massive stellar-mass black holes are not expected in a Galactic metallicity environment, owing to strong stellar winds and pair-instability supernovae. In this context, the recent report1 of an approximately 70-solar-mass (M?) black hole in the galactic binary system LB-1 challenges conventional theories of massive-star evolution, stellar winds and core-collapse supernovae, thus requiring a more exotic scenario to explain the existence and properties of this system2,3. Here we show that the apparent shifts of the H? emission line used to derive the mass of the black hole arise from the orbital motion of the B-type companion star in the LB-1 binary system and not from that of the black hole. No evidence for a massive black hole remains in the data, thus removing the existing tension between its proposed existence and models of the formation of such a massive black hole at galactic metallicity.",0.030004220083355904,0.2989415228366852,0.25329282879829407,0.033445924520492554,0.38431546092033386
10.1038/304561a0,1983,"1 WOOD AND BARTON based their analysis of the North Sea Rift on gravity, refraction and well data but did not have access to multichannel reflection data. Their conclusion that the North Sea Rift subsided in response to an extension of the crust by 110 km, 50-80 km of which occurred during the mid-Jurassic-early Cretaceous, is at variance with reflection seismic data acquired by the petroleum industry which indicate an extension of only 20-30 km at the base Zechstein Salt level.

In the central North Sea, the Zechstein Salt forms part of the pre-rift sequence and its base is a regionally correlative stratigraphical and seismic marker. Thus the extension mapped at this level gives an upper limit to the amount of extension that can have occurred during the Mesozoic rifting stage of the North Sea. Amounts of extension by faulting at the base Zechstein Salt level are probably 20-25 km, but could be as large as 30 km. It is very unlikely, however, that a multi- tude of additional faults, undetectable on multichannel seismic reflection data, could account for the doubling or quad- rupling of this amount as required by the stretching model².",0.01791691593825817,0.14519478380680084,0.18328551948070526,0.0242931991815567,0.6293095350265503
10.1038/s41586-021-03254-3,2021,"Satellite remote sensing has been widely used to monitor the water quality of inland and coastal environments. Using satellite data from the Landsat 5 Thematic Mapper (L5TM), Ho et al.1 showed an increase in peak summertime bloom intensity in 68% of the 71 large lakes worldwide from 1982 to 2012. However, we question the veracity of their finding for at least two reasons: (1) satellite-derived reflectance in a single near-infrared (NIR) band is not a reliable proxy for bloom strength, and (2) the infrequent satellite observations from L5TM make it difficult to draw statistically meaningful conclusions.",0.005083837080746889,0.04867227002978325,0.5966463685035706,0.017581773921847343,0.3320157825946808
10.1038/s41586-019-1920-x,2020,"Around the globe, governments have pledged to remove support for coal, oil and gas, noting that such fossil fuel subsidies undermine efforts to deal with climate change by keeping greenhouse gas emissions higher than they otherwise would be1. Jewell et al.2 used results of integrated assessment models to infer that eliminating subsidies would yield limited emission reductionsexcept in energy-exporting regions, and described the emission reduction benefits as small. This characterization is potentially misleading, and here we use a simple, sector-specific model to show how the emission reductions from producer subsidy reform could be more material than Jewell et al. suggest3. Fossil fuel producer subsidies delay a low-carbon transition in ways both material and political, and they deserve greater attention and transparency in global modelling analyses, as well as in policy-making.",0.034656014293432236,0.5429300665855408,0.12674646079540253,0.036723509430885315,0.25894394516944885
10.1038/281709b0,1979,"ANDERSSON and his colleagues have postulated that the K562 cell line is of erythroleukaemic origin¹ and can be 1 induced to undergo erythrocytic differen- tiation by sodium butyrate². However, treatment with sodium butyrate of the original K562 cells fails to produce ben- zidine-positive staining, cell haemoglobin crystals or the synthesis of human globin.",0.057557374238967896,0.170134499669075,0.4098340570926666,0.05348600819706917,0.30898794531822205
10.1038/304188a0,1983,"WITH the help of an ingeniously simple argument, Wootters and Zurek' have drawn attention to the fact that there exists no amplifying apparatus such as one or more excited atoms, for example, which will 'clone' an incident photon of arbitrary polarization. More precisely, if 1.1) is a one-photon state of polarization characterized by some complex unit vector &?, a photon amplifier cannot always turn this into the state (2) for an arbitrary 21. In general, the two-photon state will be some superposition of states 221, 02) and 11, 122), where £1, £2 are orthogonal unit polarization vectors, or even a mixture of states. However, the conclusion of Wootters and Zurek should not be misinterpreted to mean that the output of a photon amplifier has to be polarization dependent.",0.06645801663398743,0.3176443576812744,0.2512766420841217,0.05396699905395508,0.310653954744339
10.1038/301177a0,1983,OUR model using 813C analyses of bone apatite to obtain dietary information from modern and fossil bones¹ has been dis- puted by Schoeninger and DeNiro who say that carbon isotope ratios in fossil bone apatite cannot be used to obtain dietary information because of postmor- tem exchange of carbon². We now discuss the evidence.,0.0064713419415056705,0.0610223188996315,0.07099150866270065,0.010352280922234058,0.8511624932289124
10.1038/s41586-023-06269-0,2023,"In their recent Article, Mao et al.2 identified mitochondrially localized dihydroorotate dehydrogenase (DHODH) as an additional enzyme that mediates suppression of ferroptosis, implying that inhibition of DHODH may present a promising strategy to overcome ferroptosis resistance in cancer cells. Here we show that the contribution of DHODH in ferroptosis suppression appears to be small and context-dependent, because the ferroptosis-sensitizing effect of DHODH inhibitors is apparent only at high concentrations that also efficiently inhibit ferroptosis-suppressor protein 1 (FSP1), which has an important role in ferroptosis defence3. The observed effects on ferroptosis sensitization with this concentration of inhibitors cannot be attributed to DHODH inhibition per se. Thus, applying compounds that modulate ferroptosis at appropriate concentrations is mandatory to avoid off-target effects.",0.1209365576505661,0.31020286679267883,0.24767223000526428,0.11442924290895462,0.20675905048847198
10.1038/310165a0,1984,"ALLÈGRE ET AL. suggest that there is a climatic and hence palaeolatitude paradox implied by late Carboniferous glacial deposits and early Permian warm Cathay- sian floras, both being present in the Lhasa block of southern Tibet. To account for this paradox they claim that, if it formed part of Carboniferous Gondwanaland, the Lhasa block must have detached in the early Permian.

Allègre et al. also question, without offering evidence, the interpretation of the Carboniferous Damxung-Linzhu pebbly slates as tillites. I have never seen these deposits but it seems significant that in many of these Asian blocks proposed as parts of eastern Gondwanaland², pebbly mudstone facies of late Carboniferous age have been identified and interpreted as glacial marine diamictites (Fig. 1). Cameron et al.³ explain the lithological characteristics of these pebbly mudstone deposits by the reworking and turbiditic redeposition of ice-rafted sub-glacial or fluvioglacial debris. They explain the pres- ence of limestone with warm water faunas towards the top of the 'pebbly mudstone' by an amelioration of the climate. However, Smith et al. show that Aus- tralian Gondwanaland moved closer to the South Pole from mid-Carboniferous to early Permian times, which would not favour climatic amelioration of eastern Gondwanaland.",0.008861063979566097,0.12284120917320251,0.561346173286438,0.03789735585451126,0.2690541744232178
10.1038/320088a0,1986,"IN a recent paper, Harvey and Zammuto¹ pointed out that variation in age at first reproduction among female mammals is strongly correlated with expectation of life at birth, even after the effects of body size have been removed. We wish to make three points about the interpretation of that correlation.",0.04755876213312149,0.617431104183197,0.17395684123039246,0.04401981830596924,0.1170334741473198
10.1038/318390a0,1985,We add another curious note to the sequence similarities shared by the pro- teins identified by biological properties as either the erythroid-potentiating activity (EPA) factor associated with stimulation of erythroid precursors or the tissue inhibitor of metalloproteinases (TIMP). A recent report by Docherty et al.² demon- strates that these two proteins have iden- tical sequences.,0.13992080092430115,0.38311728835105896,0.2717630863189697,0.04999971389770508,0.1551990956068039
10.1038/307389b0,1984,"Macdonald discusses predictions that are not necessarily borne out by the model, for example: ""From the resource dispersion hypothesis one would not necessarily expect any relationship  between group size and territory area, as the two are argued to be affected, largely independently, by the abundance and dispersion of available food respectively"". The lack of such a correlation is then treated as a corroboration of the model¹. However, as RDH cannot be falsified regardless of whether there is a correlation or not, this prediction is useless for testing the hypothesis. Here I will identify and evaluate one prediction that is an invariable consequence of RDH: when the temporal variation is such that access to a given patch is vital to the territory owners, then all group members are expected to exploit this patch simultaneously.",0.05211423337459564,0.3414643108844757,0.24789465963840485,0.052915118634700775,0.3056116998195648
10.1038/266477a0,1977,"We conclude that the 8D and 8180 as determined by Libby, et al. on total wood do not give information about climate. On the other hand, we have shown that the &D analysis of the hydrogen from only the C-H groups in cellulose (isolated as nitrated cellulose) eliminates the problems of chemical heterogeneity and the ex- change with water of the hydrogen in the OH groups.",0.12200551480054855,0.19732391834259033,0.17732319235801697,0.05744585767388344,0.4459015130996704
10.1038/250443c0,1974,"SR, Bell and Clough' have reported that the growth of S23 ryegrass was substantially reduced by exposure to 12 p.p.hm. (parts per hundred million) SO. Bleasdale grew the same variety of ryegrass in greenhouses ventilated with polluted air from out-of-doors on a suburban site in Manchester and com- pared the growth with that in a green- house ventilated with purified air. There were reductions in the dry weight of the plants amounting to 57% in the polluted atmosphere, even though the SO: concentrations were below 3 ?.?. hm. for 39 out of 42 d and the daily means did not rise above 9 p.p.hm. at any time. Bleasdale's data appear to show that S23 ryegrass is more sensitive to SO2 than is apparent from the study by Bell and Clough. This discrepancy may be the result of their having performed experiments in different conditions, but it may equally have resulted from Bell and Clough's simulated SO2 pollution rather than polluted air from outside. In Bleasdale's experiments other air pollutants would also have been present. One such is NO2. This is found in polluted atmospheres because NO is produced by combination when fossil fuels are burnt, and is quickly oxidised in air to NO2. We have recently completed some experiments in which the combined effects of SO2 and NO pollution on photosynthesis in the pea, p.p.hm. and above of both SO, and NO were found to produce visible lesions on intact plants. Visible injury to crop plants after simultaneous exposure to SO2 and NO2 has been reported pre- viously³.
Our data suggest that combined effects of SO and NO might explain the growth inhibition caused by urban pollution, and that this possibility should be considered in future studies.",0.038794152438640594,0.27711021900177,0.25930121541023254,0.10022541880607605,0.32456907629966736
10.1038/313073c0,1985,"The phrasing of the authors' conclusion that the connection of reading acquisition to phonological awareness is a causal one is unfortunate, however. If 'causal' means a link that runs one way only, the implica- tion is to deny the possibility of the inverse type of relation. There is evidence, in fact, that learning to read improves understand- ing of the phonological structure of speech and hence ability to manipulate it at the level of phonetic segments. We have found, for example, that first grade (6-yr- old) children taught by a look-say method performed more poorly on the task of interverting initial and final phonemes of an utterance than children taught by a phonic method². ",0.08063951134681702,0.11962471902370453,0.18872769176959991,0.04040348529815674,0.5706045627593994
10.1038/s41586-020-03131-5,2021,"The Hippo pathway regulates cell growth and fate decisions, organ size and tissue homeostasis, and its dysregulation contributes to tumorigenesis1,2. Britschgi et al.3 previously reported that the Hippo-pathway kinases LATS1 and LATS2 (hereafter, LATS1/2) promote degradation of ER?, which is encoded by the ESR1 gene, in a manner independent of their kinase activity or downstream effectors YAP and TAZ. Here we report that LATS1/2 are required to maintain ER? expression, as deletion of LATS1/2 abolishes ESR1 mRNA and protein in breast, endometrium and Fallopian tube epithelial cells in a manner dependent on LATS kinase activity as well as YAP and TAZ. Consistently, LATS1/2 deletion selectively inhibits growth of ER?+, but not ER??, breast cancer cellsthus revealing a role for LATS1/2 in breast cancer, and a functional crosstalk between Hippo signalling and ER?.",0.11534411460161209,0.41397354006767273,0.21103540062904358,0.08086862415075302,0.17877830564975739
10.1038/s41586-020-2803-x,2020,"In their study, Clark et al.1 suggest that previous studies on the effects of elevated levels of CO2 on the behaviour of coral reef fishes are not repeatable and that ocean acidification does not impair the behaviour of coral reef fishes, even though six significant behavioural effects were detected in their study, each of which was dismissed for a different reason. They then compare the means and variances of six previous ocean acidification studies in fish with a data distribution that is derived from a multi-species compilation of their own data to conclude that the results of previous studies are statistically improbable. However, Clark et al.1 did not closely repeat previous studies, as they did not replicate key species, used different life stages and ecological histories and changed methods in important ways that reduce the likelihood of detecting the effects of ocean acidification.",0.055571217089891434,0.19445207715034485,0.19767111539840698,0.18586279451847076,0.36644279956817627
10.1038/308562a0,1984,"STANLEY AND GAY¹ recently reported the determination of the complete nucleo tide sequences of the two circular DNA molecules (DNAs 1 and 2) that make up the genome of cassava latent virus (CLV), a member of the geminivirus group. Several open reading frames (ORFs) capable of encoding proteins of molecular weights greater than 10,000 were identified in both strands of DNAs 1 and 2. Interestingly, two ORFs which are capable of encoding proteins of similar sizes (molecular weights 30,100 and 29,200) are present at equivalent positions on DNAs 1 and 2. We have compared the amino acid sequences of these proteins by a computer-assisted method described previously and found that they are closely related (Fig. 1). Of all the positions com- pared in the aligned sequences, 43% are occupied by residues that are identical or chemically similar (gaps were considered as substitutions between dissimilar amino acids regardless of their length). Further- more, a statistical test shows that the simi- larity between the aligned sequences is highly significant, with a probability of occurrence by chance of 4.3×10-6. The presence of such extensive sequence simi- larity suggests that like the ORF of DNA 1, which is known to code for the coat protein of CLV (ref. 1 and J. Stanley, personal communication), the ORF of DNA 2 also encodes a functional protein. Although no such extensive sequence similarities were found for other ORFs, the present result, together with the simi- larity in size of the two viral DNAs and the fact that they share a very similar non-coding segment in common¹, also suggests that the bipartite viral genome has evolved from a single common ances- tral DNA.",0.3105485439300537,0.34057796001434326,0.1550038754940033,0.09894710779190063,0.09492248296737671
10.1038/270543c0,1977,"BOWERY and Dray' have suggested that pentobarbitone reverses the effects of the y-aminobutyric acid (GABA) antagonist bicuculline methochloride (BMC), on both the superfused rat superior cervical ganglion and rat medullary neurones in vivo, without potentiating the action of GABA on these tissues in the absence of BMC. Such an action does not readily account for the accentuation by pentobarbitone of inhibitions mediated by GABA in the mammalian central nervous system, except by antagonism of an as yet undetected endogenous GABA antagonist.
In confirmation of Bowery and Dray', pentobarbitone (10-60 nA) partially reversed the antagonism by BMC of the inhibition of cell firing by GABA. With most neurones, however, in the absence of BMC, pentobarbitone ejected with the same or even lower electrophoretic currents enhanced submaximal inhibition of firing by GABA. Furthermore, the inhibitory action of electrophoretic glycine on many cells was also enhanced, but not to the same extent as that of GABA.",0.15246780216693878,0.4239635169506073,0.2577253580093384,0.10573433339595795,0.06010903790593147
10.1038/290427a0,1981,"THE nature of lipidic 'particles' and 'pits' in freeze-fracture replicas of liposomes has been much debated. Recently, Miller¹ presented arguments that the particles and pits represent conical deformations of membranes, rather than inverted micelles sandwiched between membrane leaflets-a model repeatedly suggested by Verkleij et al.24. We have also observed lipidic particles and pits in liposomes of mixed egg phosphatidyl- choline (PC)-soybean phosphatidyl- ethanolamine (PE) and mixed PC-PE- cardiolipin, and our results essentially agreed with those of others¹¹. Moreover, we have more convincing evidence for the deformation model as presented below. The evidence has led us independently to arrive at a similar model to that proposed by Miller.",0.5446900129318237,0.17653706669807434,0.1587270349264145,0.06688226014375687,0.05316358804702759
10.1038/298301c0,1982,"ACCORDING to Chiodo and Antelman', repeated daily treatment of rats with tricyclic antidepressants results in a 'sub- sensitivity' of dopamine autoreceptors. Using extracellular single unit recording methods, they measured the responsive- ness of neurones located within the sub- stantia nigra zona compacta, to a low (4 µg per kg, intravenously) dose of apomorphine. In these experiments, the effects of apomorphine were dramatically attenuated in rats that had been treated for 10 days with amitriptyline, imipramine or iprindole as compared with saline- treated rats.",0.5329763293266296,0.22586123645305634,0.18628545105457306,0.03812089189887047,0.016756176948547363
10.1038/321536a0,1986,"ACCORDING to Falk', the endocast mor- phology of the Hadar hominid AL 162-28 is ape-like, contrasting with Holloway's² original conclusion that this specimen exhibits important human-like cortical features. We contend that Falk's interpre- tation is the result of a major error in her orientation of the endocast.",0.01846688613295555,0.1177864596247673,0.28282326459884644,0.05881402641534805,0.5221093893051147
10.1038/s41586-021-03293-w,2021,"Using remote-sensing data on forest cover change in the European Union (EU), Ceccherini et al.1 report an abrupt increase in harvested biomass (69%) and in harvested forest area (43%) on the basis of a comparison between two periods, 20102015 and 20162018, in a single decade. They demonstrate a spike in harvests in 20162018, and use the short-term rise to infer a long-term trend of increasing harvests, causing them to question the viability of European forests remaining a terrestrial carbon sink in the future. They then suggest that the recent expansion of wood markets around the globe may portend sustained growth in the area harvested for forest products in the EU, and that this might adversely affect goals to mitigate climate change in the coming decades. We feel that this argument is misinformed and, together with their analysis, leads Ceccherini et al.1 to several errors in their conclusions.",0.03277944400906563,0.09185883402824402,0.4047011137008667,0.04005592316389084,0.4306047558784485
