DOI,PPC_Year,Abstract,agree,clarification,question,recommendation,disagree
10.1126/science.1168940,2009,"García-Barriocanal et al. (Reports, 1 August 2008, p. 676) reported colossal conductivity enhancements in yttria-stabilized zirconia (YSZ)/strontium titanate (STO) epitaxial heterostructures and claimed that the conductivity was ionic. I argue that the claimed ionic conductivity lacks experimental support and that the observed conductivity enhancement is most probably due to the p-type conductivity of STO.",0.011442606337368488,0.14027629792690277,0.3645702302455902,0.042668964713811874,0.44104188680648804
10.1126/science.aaw9367,2019,"Zhou et al. (Reports, 5 October 2018, p. 69) claim to have proven dominance of hot electrons over thermal effects in plasmonic photocatalysis. We identify experimental flaws that caused overestimation of the hot carrier contribution. As an alternative interpretation, we fully reproduce their data using a purely thermal Arrhenius law with a fixed activation energy and intensity-dependent heating. ",0.05360786244273186,0.31157973408699036,0.2668420970439911,0.07164233922958374,0.29632797837257385
10.1126/science.1152111,2008,"McGillicuddy et al. (Reports, 18 May 2007, p. 1021) proposed that eddy/wind interactions enhance the vertical nutrient flux in mode-water eddies, thus feeding large mid-ocean plankton blooms. We argue that the supply of nutrients to ocean eddies is most likely affected by submesoscale processes that act along the periphery of eddies and can induce vertical velocities several times larger than those due to eddy/wind interactions.",0.06419183313846588,0.22670871019363403,0.31624242663383484,0.1028403639793396,0.2900165617465973
10.1126/science.1129402,2007,"Herbert et al. (Reports, 14 April 2006, p. 279) reported an association between the INSIG2 gene variant rs7566605 and obesity in four sample populations, under a recessive model. We attempted to replicate this result in 10,265 Caucasian individuals, combining family-based, case-control, and general population studies, but found no support for a major role of this variant in obesity.",0.1358482390642166,0.22185063362121582,0.2659751772880554,0.07741264253854752,0.2989133894443512
10.1126/science.1233937,2013,"Cramer et al. (Reports, 23 March 2012, p. 1503; published online 9 February 2012) tested bexarotene as a potential ?-amyloid-lowering drug for Alzheimer's disease (AD). We were not able to reproduce the described effects in several animal models. Drug formulation appears very critical. Our data call for extreme caution when considering this compound for use in AD patients.",0.11511453986167908,0.18644464015960693,0.2584347128868103,0.06397538632154465,0.37603068351745605
10.1126/science.1108864,2005,"Smith et al. (1) reported an x-ray absorption spectroscopy (XAS) study of water in a liquid microjet from supercooled to room temperature. From the apparently strong spectral variation with temperature and a subsequent analysis based on fitting sums of Gaussians, they inferred a tetrahedral model for bulk water. Both data and analysis contradict a previous XAS study by Wernet et al. (2) that reported a much smaller temperature dependence for room-temperature water versus 90°C water and, based on a series of experimental and analytical methods, suggested that a dominating fraction of molecules have asymmetrical donating hydrogen bonds (H bonds). We argue here that the Smith et al. (1) study contains fundamental shortcomings, with respect both to the experimental spectra and the data analysis, that need to be addressed, and conclude that the energetics of different species in liquid water cannot be reliably derived from that study.",0.027358660474419594,0.1984395533800125,0.19711433351039886,0.03718957304954529,0.5398978590965271
10.1126/science.1082380,2003,"Two recent reports (1, 2) have compared transcription profiles of mouse embryonic stem cells (ESCs), neural stem cells (NSCs), and hematopoeitic stem cells (HSCs). Both identified a set of genes common to all three types of stem cells and proposed that these genes reveal core stem cell properties (or `stemness') (1) or define a common SC [stem cell] genetic program or SC molecular signature (2). We thought that it would be worthwhile to compare the stem cell essential gene sets as reported in the two papers and to determine how many of the 230 stem cell genes listed by Ramalho-Santos et al. (1) can be found among the 283 stem cell genes listed by Ivanova et al. (2). For this, we compared the lists of Affymetrix IDs given for every gene in both lists. To our considerable surprise, only six genes can be found in both sets (1.2% overlap). Moreover, when we compared the 230 stem cell genes listed by Ramalho-Santos et al. (1) with the 899 genes expressed in at least two of the three stem cell types presented by Ivanova et al. (2), only 17 common genes may be found (1.5% overlap).",0.07641132920980453,0.21213144063949585,0.3507606089115143,0.09978844970464706,0.26090818643569946
10.1126/science.aat8603,2018,"Ahneman et al. (Reports, 13 April 2018) applied machine learning models to predict CN cross-coupling reaction yields. The models use atomic, electronic, and vibrational descriptors as input features. However, the experimental design is insufficient to distinguish models trained on chemical features from those trained solely on random-valued features in retrospective and prospective test scenarios, thus failing classical controls in machine learning. ",0.19358210265636444,0.13872753083705902,0.1633257269859314,0.06632541865110397,0.43803927302360535
10.1126/science.1216682,2012,"We show that the structure demonstrated by Feng et al. (Reports, 5 August 2011, p. 729) cannot enable optical isolation because it possesses a symmetric scattering matrix. Moreover, one cannot construct an optical isolator by incorporating this structure into any system as long as the system is linear and time-independent and is described by materials with a scalar dielectric function.",0.09589415788650513,0.475311815738678,0.11550672352313995,0.010904072783887386,0.30238327383995056
10.1126/science.1234089,2013,"Cramer et al . (Reports, 23 March 2012, p. 1503; published online 9 February 2012) demonstrates short-term bexarotene treatment clearing preexisting ?-amyloid deposits from the brains of APP/PS1?E9 mice with low amyloid burden, providing a rationale for repurposing this anticancer agent as an Alzheimer 's disease (AD) therapeutic. Using a nearly identical treatment regimen, we were unable to detect any evidence of drug efficacy despite demonstration of target engagement.",0.10557533800601959,0.29097139835357666,0.11174587160348892,0.4108355939388275,0.08087179809808731
10.1126/science.1235809,2013,"Cramer et al. (Reports, 23 March 2012, p. 1503; published online 9 February 2012) demonstrated in a mouse model for Alzheimer's disease (AD) that treatment of APP/PS1?E9 mice with bexarotene decreased A? pathology and ameliorated memory deficits. We confirm the reversal of memory deficits in APP/PS1?E9 mice expressing human APOE3 or APOE4 to the levels of their nontransgenic controls and the significant decrease of interstitial fluid A?, but not the effects on amyloid deposition.",0.30681994557380676,0.23151619732379913,0.20359010994434357,0.08121301978826523,0.1768607199192047
10.1126/science.1199544,2011,"Zhao and Running (Reports, 20 August 2010, p. 940) reported that global net primary production has declined over the past decade and that this reduction was caused by drought. However, their findings are not direct measurements, but rather are based on outcomes from models in which a strong temperature dependence is assumed. I examine the assumptions underlying their results and show that their findings can be explained as logical consequences of these assumptions.",0.054022397845983505,0.5297068953514099,0.19141711294651031,0.06735121458768845,0.15750233829021454
10.1126/science.1147046,2008,"We used authentication tests developed for ancient DNA to evaluate claims by Asara et al. (Reports, 13 April 2007, p. 280) of collagen peptide sequences recovered from mastodon and Tyrannosaurus rex fossils. Although the mastodon samples pass these tests, absence of amino acid composition data, lack of evidence for peptide deamidation, and association of ?1(I) collagen sequences with amphibians rather than birds suggest that T. rex does not.",0.06831473857164383,0.19407276809215546,0.32084304094314575,0.04503262788057327,0.3717367947101593
10.1126/science.1141960,2007,"Waters and Stafford (Reports, 23 February 2007, p. 1122) provided useful information about the age of some Clovis sites but have not definitively established the temporal span of this cultural complex in the Americas. Only a continuing program of radiometric dating and careful stratigraphic correlations can address the lingering ambiguity about the emergence and spread of Clovis culture.",0.07641340792179108,0.10930844396352768,0.5725650191307068,0.07371088862419128,0.168002188205719
10.1126/science.1100464,2004,"The cytidine deaminase APOBEC3G (A3G) was recently identified as a natural resistance gene that restricts efficient propagation of human immunodeficiency virus and other retroviruses. The enzyme induces massive cytidine to uridine (C? U) deamination of single-stranded retroviral DNA, resulting in DNA degradation or lethal guanine to adenine (G? A) hypermutation (1). Hepadnaviruses, including hepatitis B virus (HBV), replicate by reverse transcription of a pregenomic RNA intermediate inside nucleocapsids, placing them into the family of retroelements (2). These observations, along with an earlier report describing G? A hypermutations in natural HBV variants (3), raise the question of whether HBV represents another potential target for A3G. Turelli et al. showed that this is indeed the case (4). Surprisingly, however, inhibition of viral pregenome packaging rather than induction of G? A hypermutations was identified as the main antiviral mechanism. No significant nucleotide changes were detected in a total of 40 polymerase chain reaction (PCR)amplified HBV clones derived from cotransfected Huh7 hepatoma cells. Turelli et al. discussed the possibility that A3G-mediated HBV editing may occur in a different cellular context.",0.11262069642543793,0.2928834855556488,0.3831191062927246,0.05253570154309273,0.15884104371070862
10.1126/science.1108198,1976,"Single-cell oscillations of signaling proteins can only be detected by time-lapse imaging of fluorescent proteins. We discussed the functionality of our NF-?B (RelA) and I?B? fusion constructs in Section A of the supplementary material in (1), and it is clearly important to control for and to minimize overexpression. We previously showed that the I?B?:RelA ratio affects the timing of translocation responses (2) and that sensitive parameters such as NF-?Bdependent I?B? transcription significantly affect the system (1, 3). The ability to relate expression level to behavior of the system [see figure 3 in (1)] allowed us to identify when ectopic expression perturbs the system and provides information to improve computational models.",0.30597609281539917,0.22722581028938293,0.16436994075775146,0.15562938153743744,0.1467987596988678
10.1126/science.1078412,2003,"Wagers et al. (1) investigated the possibility of marrow cell plasticity at the single cell level, as we did (2). Although they found little evidence for developmental plasticity i.e., marrow cells giving rise to mesoderm (blood), endoderm (liver), and ectoderm (brain)their experiment substantially differed from ours and is therefore not a clear refutation of our previous work.",0.057552140206098557,0.03128138184547424,0.35030755400657654,0.0434487946331501,0.517410159111023
10.1126/science.1209658,2012,"Li et al. (Research Articles, 1 July 2011, p. 53; published online 19 May 2011) reported large numbers of differences between DNA and messenger RNA in human cells, indicating unprecedented levels of RNA editing, and including sequence changes not produced by any of the known RNA editing mechanisms. However, common sources of systematic errors in high-throughput sequencing technology, which were not properly accounted for in this study, explain most of the claimed differences.",0.10106571018695831,0.2767046391963959,0.25462543964385986,0.07956890016794205,0.2880353629589081
10.1126/science.1101338,2004,"Chen et al. (1) reported coelomate bilaterians from the ?600-million-year-old Doushantuo phosphorites in southern China. Such a find might meet some common expectations of small, simple bilaterians emerging after the worldwide glaciations of the Neoproterozoic. The interpretation is not well founded, however, because it fails to take into full account taphonomy (changes in the organism after death) and diagenesis (changes in the sediment after deposition).",0.04347020015120506,0.03355498984456062,0.29190677404403687,0.011761144734919071,0.6193068623542786
10.1126/science.1078714,2003,"Achard et al. (1) estimated tropical deforestation and atmospheric carbon emissions from 1990 to 1997 and concluded that both were substantially lower than had been found in previous studies. However, we believe that the evidence favors higher estimates, particularly for carbon emissions. We would cite seven specific items that suggest a cautious approach toward the Achard et al. results.",0.035154491662979126,0.17414531111717224,0.2008110135793686,0.20274661481380463,0.387142539024353
10.1126/science.aan8074,2017,"Kattel et al. (Reports, 24 March 2017, p. 1296) report that a zinc on copper (Zn/Cu) surface undergoes oxidation to zinc oxide/copper (ZnO/Cu) during carbon dioxide (CO2) hydrogenation to methanol and conclude that the Cu-ZnO interface is the active site for methanol synthesis. Similar experiments conducted two decades ago by Fujitani and Nakamura et al. demonstrated that Zn is attached to formate rather than being fully oxidized.",0.21205389499664307,0.360083669424057,0.194546639919281,0.09287641197443008,0.1404394656419754
10.1126/science.1198191,2011,"Larsen et al. (Reports, 2 July 2010, p. 65) suggest that, contrary to the established paradigm, the aqueous electron does not carve out and occupy a cavity in liquid water. Closer examination of their theoretical model, however, reveals that many of its predictions differ substantively from established benchmarks and that its behavior differs qualitatively from Hartree-Fock theory, upon which the model is based.",0.03550098091363907,0.1047767922282219,0.1917489618062973,0.043817900121212006,0.6241554021835327
10.1126/science.1147650,2007,"Chung et al. (Reports, 20 April 2007, p. 436) reported the synthesis of superhard rhenium diboride (ReB2) at ambient pressure. We show that ReB2, first synthesized at ambient pressure 45 years ago, is not a superhard material. Together with the high cost of Re, this makes the prospect for large-scale industrial applications of ReB2 doubtful.",0.08191324025392532,0.37352582812309265,0.14069975912570953,0.03232543542981148,0.3715357184410095
10.1126/science.aay8060,2019,"Bastin et al. (Reports, 5 July 2019, p. 76) claim that global tree restoration is the most effective climate change solution to date, with a reported carbon storage potential of 205 gigatonnes of carbon. However, this estimate and its implications for climate mitigation are inconsistent with the dynamics of the global carbon cycle and its response to anthropogenic carbon dioxide emissions. ",0.01588723063468933,0.04912203550338745,0.15951913595199585,0.029422122985124588,0.7460494041442871
10.1126/science.1110820,2005,"Raoult et al. (1) analyzed the complete genome sequence of Mimivirus, the largest known virus. One of the most exciting results of this analysis is the identification of seven conserved mimiviral proteins that are evolutionarily related to their eukaryotic homologs: arginyl-tRNA synthetase, methyonyl-tRNA synthetase, tyrosyl-tRNA synthetase, the largest and second largest subunit of RNA polymerase II, DNA-polymerase sliding clamp protein (PCNA), and 5?-3? exonuclease. Moreover, the phylogenetic analysis of a concatenation of these protein sequences suggests that the Mimivirus emerges at the base of the eukaryotic branch in a tree of species from the three domains of life: eukaryotes, bacteria, and archaea [figure 3 in (1)]. Raoult et al. concluded their analysis by suggesting that Mimivirus appears to define a new branch distinct from the three other domains and that it could have played a role in the origin of eukaryotes. Such a revolution in our conception of the tree of life deserves a close scrutiny.",0.16916874051094055,0.2973081171512604,0.22799859941005707,0.1721409261226654,0.13338357210159302
10.1126/science.1121144,2006,"Endocast analysis of the brain Homo floresiensis by Falk et al. (Reports, 8 April 2005, p. 242) implies that the hominid is an insular dwarf derived from H. erectus, but its tiny cranial capacity cannot result from normal dwarfing. Consideration of more appropriate microcephalic syndromes and specimens supports the hypothesis of modern human microcephaly.",0.14068526029586792,0.33126163482666016,0.26595842838287354,0.10932217538356781,0.15277256071567535
10.1126/science.1089523,2003,"Eden et al. (1) and Gaudet et al. (2) reported increased tumorigenesis in mice with DNA hypomethylation and attributed these results to increased chromosomal instability. Both Gaudet et al. (2) and Lengauer (3) caution that these results could have negative implications for the use of hypomethylating agents in the treatment of cancer. However, we would like to caution against overinterpretation of these papers.",0.044981297105550766,0.40675175189971924,0.19609235227108002,0.08059152960777283,0.27158305048942566
10.1126/science.1210624,2012,"Li et al. (Research Articles, 1 July 2011, p. 53; published online 19 May 2011) reported widespread differences between the RNA and DNA sequences of the same human cells, including all 12 possible mismatch types. Before accepting such a fundamental claim, a deeper analysis of the sequencing data is required to discern true differences between RNA and DNA from potential artifacts.",0.07832485437393188,0.11116530001163483,0.49200454354286194,0.04072161391377449,0.27778369188308716
10.1126/science.1083647,2003,"Discovery of a plastid in apicomplexan parasites such as Toxoplasma and Plasmodium (1, 2) has prompted intense debate over whether the plastid originates from a red algal or a green algal ancestor (35). Funes et al. (6) argued for a green algal ancestry based on analysis of the cox2 gene, which encodes COXII, a subunit of the mitochondrial cytochrome c oxidase (complex IV of the mitochondrial respiratory chain). Apicomplexan parasites are unusual in that COXII is encoded in the nucleus (7). In all other organisms studied, with the notable exceptions of certain green algae and leguminous plants, COXII is encoded by the mitochondrial genome (8, 9). Intriguingly, the COXII protein of apicomplexan parasites comprises two polypeptides corresponding to the NH2-terminal and COOH-terminal domains of the canonical COXII. The two domains are encoded by two nuclear genes, cox2a and cox2b (7). This gene separation also occurs in certain green algae, where it appears that the cox2 gene split in the mitochondrial DNA before cox2a and cox2b transferred to the nucleus (6). Funes et al. (6) presented a phylogeny of COXII indicating that apicomplexan genes are most closely related to the cox2 genes of green algae. They further suggested that apicomplexa acquired their split cox2a and cox2b genes through lateral gene transfer (presumably nucleus to nucleus) from the endosymbiotic (green) alga that gave rise to the plastid.",0.014755894429981709,0.2071121633052826,0.38975775241851807,0.10949459671974182,0.27887964248657227
10.1126/science.aam9364,2017,"Medvedev et al. (Reports, 6 January 2017, p. 49) argue that recent density functionals stray from the path toward exactness. This conclusion rests on very compact 1s2 and 1s22s2 systems favored by the Hartree-Fock picture. Comparison to actual energies for the same systems indicates that the ""straying"" is not chemically relevant and is at best specific to the studied dense systems. ",0.07169324904680252,0.21179352700710297,0.3155953884124756,0.11370085179805756,0.2872169613838196
10.1126/science.aaz0388,2019,"Bastin et al. (Reports, 5 July 2019, p. 76) state that the restoration potential of new forests globally is 205 gigatonnes of carbon, conclude that global tree restoration is our most effective climate change solution to date, and state that climate change will drive the loss of 450 million hectares of existing tropical forest by 2050. Here we show that these three statements are incorrect. Copyright ",0.01653812825679779,0.2777341604232788,0.08651763200759888,0.027736082673072815,0.5914741158485413
10.1126/science.1197559,2011,"Larsen et al. (Reports, 2 July 2010, p. 65) challenged the long-standing model of the solvent geometry surrounding a free electron in water using molecular dynamics simulations based on a newly derived electron-water pseudopotential. We illustrate that, in contrast to the model they used, the true electron-water interaction is repulsive in the region relevant to the reported extended electron distribution, consistent with the cavity model.",0.032665882259607315,0.18621976673603058,0.2517758011817932,0.03492819890379906,0.49441036581993103
10.1126/science.1084237,2003,"For more than a decade, there has been extensive discussion about whether hippocampal sclerosis causes enhanced neuronal excitability as a prerequisite for seizure generation. The disorder known as Ammon's horn sclerosis (AHS) is characterized by pronounced cell loss and gliosis in various regions of the hippocampal formation, leaving the subiculum generally intact (1, 2). Given the hypothesis that epileptic activity is generated within the hippocampal formation when the CA3 and CA1 regions are damaged or even absent, it is feasible that the adjacent subiculum is uniquely responsible for the generation of limbic seizures. Using multielectrode recordings in hippocampal brain slices of patients with temporal lobe epilepsy (TLE) and hippocampal sclerosis, Cohen et al. (3) detected spontaneous, rhythmic spikes in the subiculum but rarely in the CA3 or CA1 regions. This activity closely resembled the discharges seen on the electroencephalograms (EEGs) of these patients. Cohen et al. (3) therefore concluded that in patients with AHS, deafferentation of the subiculum initiates an epileptogenic plasticity that includes changes in glutamatergic or ?-aminobutyric acid (GABA)-ergic signaling.",0.18863040208816528,0.2729590833187103,0.29774489998817444,0.13239708542823792,0.108268603682518
10.1126/science.1149590,2007,"Kelly et al. (Brevia, 20 July 2007, p. 337) questioned xenotransplant experiments supporting the cancer stem cell (CSC) hypothesis because they found a high frequency of leukemia-initiating cells (L-IC) in some transgenic mouse models. However, the CSC hypothesis depends on prospective purification of cells with tumor-initiating capacity, irrespective of frequency. Moreover, we found similar L-IC frequencies in genetically comparable leukemias using syngeneic or xenogeneic models.",0.006626161281019449,0.05132829025387764,0.7124035954475403,0.00796846766024828,0.22167351841926575
10.1126/science.1102132,2004,"In a well-designed North Sea study, Thomas et al.(1) found that atmospheric carbon dioxide (CO2) was absorbed by continental shelf water and was eventually exported into the North Atlantic Ocean. The work confirmed preliminary observations in the same area (2, 3) and provided support for the continental shelf pump hypothesis (4, 5). Thomas et al. then extrapolated the CO2 uptake by the North Sea to the global scale and inferred a net oceanic uptake of atmospheric CO2 by coastal oceans of 0.4 Pg C year1. A previous global extrapolation based on limited observations in the East China Sea (ECS) suggested an even greater air-sea CO2 flux of 1.0 Pg C year1 in the world's continental shelf (4). We are concerned with such extrapolations of regional studies to the global scale without cautioning readers that no current consensus exists on this issue.",0.022831762209534645,0.12430063635110855,0.5073490142822266,0.04860423877835274,0.29691430926322937
10.1126/science.1112996,2005,"Stuart et al. (2) recently reported results from the Global Amphibian Assessment (GAA) (3), which indicate that 1856 species are being threatened worldwide [also see (4)]. However, the results published for Brazilian species largely differ from the categorization indicated by specialists (3, 5) [Science Online Material (SOM) Text]. Specialists indicate 24 Brazilian species as threatened, whereas the GAA shows 110 species (3, 5) (Table 1 and SOM Text). This overestimation occurred as a result of the misuse of IUCNThe World Conservation Union Red List criteria (6) during a reevaluation later performed by the GAA coordinating team (3, 5) (SOM Text).",0.017018403857946396,0.1210368275642395,0.10948310047388077,0.029663367196917534,0.7227982878684998
